{
  "schema": "mts-proof-evidence/v0.1",
  "theoremId": "FND-03",
  "mts": {
    "acceptedVersion": "v0.14",
    "sourceCommitSha": "fcbc97e2279471c2c5effed57685c5f49ec856be",
    "contractBlobSha": "956fe6e79ddf7a7ba2664113e97633d6fa8a486f"
  },
  "assumptions": [
    "FND-01",
    "FND-02",
    "accepted Context-relative orientation"
  ],
  "dependencies": [
    "FND-01",
    "FND-02"
  ],
  "result": "proved",
  "authority": "external-cross-check",
  "lane": "lean4",
  "proofSource": {
    "repository": "netkeep80/anum_docs",
    "commitSha": "2ef10b56c611e947f4cd0f535afceebd4eaf6a5c",
    "toolchain": {
      "name": "Lean",
      "pin": "v4.34.1@5045d0056413266e57c625dcd7c365b10e377c52;linux-sha256=47bf4bbd78f70c2e9670598ab7124d92b6efb7330ff33e5fbb4030f6fd72e4e4"
    }
  },
  "artifacts": [
    {
      "path": "proofs/lean4/MtsFoundation.lean",
      "sha256": "873843cd2ed991b07d9567ae06dfc7bee55db295d3f7494a7d09186c5f194880"
    }
  ],
  "notes": "External differential proof only. FND-03 derives the named R/O/C/L representatives inside the single Foundation.Link carrier: R is the existing Foundation root, O/C are ContextOneSidedNames for the already supplied proper one-sided F2/F3 witnesses, and L is formed by the ordinary Link-forming primitive. FND-02 is consumed only for unique full-self/root identification. Context-relative naming labels existing Links and introduces no absolute Foundation-global orientation. No four-constructor datatype, symbolic name, implementation handle, codec digit, or host representation becomes MTS ontology or semantic authority. No additional external mathematical theory is introduced. Provenance repair: proofSource is pinned to the reachable merge commit carrying byte-identical kernel-GREEN proof artifacts from the original Wave-B1 source."
}
