{
  "schema": "mts-proof-evidence/v0.1",
  "theoremId": "FND-08",
  "mts": {
    "acceptedVersion": "v0.14",
    "sourceCommitSha": "fcbc97e2279471c2c5effed57685c5f49ec856be",
    "contractBlobSha": "956fe6e79ddf7a7ba2664113e97633d6fa8a486f"
  },
  "assumptions": [
    "FND-07 current contextual-truth boundary only; selected Theory relations are not CurrentScopeMember rules",
    "SelectedTheoryReactionSemantics as the accepted V14-L11/V14-L4 admission/match/emission/reaction premise"
  ],
  "dependencies": [
    "FND-07"
  ],
  "result": "proved",
  "authority": "external-cross-check",
  "lane": "lean4",
  "proofSource": {
    "repository": "netkeep80/anum_docs",
    "commitSha": "23584eb5269f684054e649b32b98ab38a333e76a",
    "toolchain": {
      "name": "Lean",
      "pin": "v4.34.1@5045d0056413266e57c625dcd7c365b10e377c52;linux-sha256=47bf4bbd78f70c2e9670598ab7124d92b6efb7330ff33e5fbb4030f6fd72e4e4"
    }
  },
  "artifacts": [
    {
      "path": "proofs/lean4/MtsFoundation.lean",
      "sha256": "676fd1af9ccee430cdb8288082b767ecf7c789e2158c7fd48eccafe4d0fef0fb"
    }
  ],
  "notes": "External differential proof only. FND-08 uses two distinct Prop-valued Scope projections: CurrentScopeMember for the published pre-reaction Scope and NextScopeMember for the successor Scope. FND-07 is consumed only for the current contextual-truth boundary; ContextualScopeCompositionLaw is not consumed by FND-08 and no selected-Theory relation is coerced into CurrentScopeMember/ContextualRule. SelectedTheoryReactionSemantics is the explicitly classified accepted V14-L11/V14-L4 premise supplying Theory selection, applicability, emitted image and reaction occurrence. The theorem proves unmatched-current survival, positive emitted-image contribution, and Reacted iff some current antecedent has a selected matching relation. Quiescence is proved extensionally only from not Reacted, so active identity remains distinct from quiescence. Host predicates are proof vocabulary over the single Link carrier only; no host collection, rule-kind, multivalued-function or cardinality opcode becomes MTS semantic authority. Provenance reachability bridge after squash merge #1833: proofSource now anchors the byte-identical proof artifact in reachable main commit 23584eb5269f684054e649b32b98ab38a333e76a. Kernel validation CI #8552 ran before squash on the exact artifact SHA-256 recorded in this evidence; the merged main proof blob is byte-identical."
}
