{
  "schema": "mts-proof-evidence/v0.1",
  "theoremId": "FND-01",
  "mts": {
    "acceptedVersion": "v0.14",
    "sourceCommitSha": "fcbc97e2279471c2c5effed57685c5f49ec856be",
    "contractBlobSha": "956fe6e79ddf7a7ba2664113e97633d6fa8a486f"
  },
  "assumptions": [
    "one Link-forming primitive",
    "A1 recursive separation for unique full self-closure / FND-02",
    "F2/F3 grounded-form existence/sufficiency for the declared realizability domain",
    "explicit local self-incidence decision evidence for the classified Link",
    "Context orientation only names one-sided cases; it does not create them"
  ],
  "dependencies": [
    "FND-02"
  ],
  "result": "proved",
  "authority": "external-cross-check",
  "lane": "lean4",
  "proofSource": {
    "repository": "netkeep80/anum_docs",
    "commitSha": "ab0dc7f53ec7ee7fa32942be3684062c5b8bd616",
    "toolchain": {
      "name": "Lean",
      "pin": "v4.34.1@5045d0056413266e57c625dcd7c365b10e377c52;linux-sha256=47bf4bbd78f70c2e9670598ab7124d92b6efb7330ff33e5fbb4030f6fd72e4e4"
    }
  },
  "artifacts": [
    {
      "path": "proofs/lean4/MtsFoundation.lean",
      "sha256": "d5d896bb28651511c25b4c385aa85c97acb0d298f821ae1547053277735052fe"
    }
  ],
  "notes": "External differential proof only. FND-01 proves the four proposition-level self-incidence classes and their finite Grounded realizability without importing normalization or ordered-pole extensionality. Unique ROOT is consumed through FND-02/A1. Ordered-pole identity remains the separate FND-13 theorem. LocalSelfDecision remains explicit, ContextOneSidedNames remains alias-only, and no host enum/codec/handle becomes authority."
}
