{
  "schema": "mts-proof-evidence/v0.1",
  "theoremId": "INV-05",
  "mts": {
    "acceptedVersion": "v0.14",
    "sourceCommitSha": "fcbc97e2279471c2c5effed57685c5f49ec856be",
    "contractBlobSha": "956fe6e79ddf7a7ba2664113e97633d6fa8a486f"
  },
  "assumptions": [
    "INV-01",
    "INV-02",
    "INV-04"
  ],
  "dependencies": [
    "INV-01",
    "INV-02",
    "INV-04"
  ],
  "result": "proved",
  "authority": "external-cross-check",
  "lane": "lean4",
  "proofSource": {
    "repository": "netkeep80/anum_docs",
    "commitSha": "ab0dc7f53ec7ee7fa32942be3684062c5b8bd616",
    "toolchain": {
      "name": "Lean",
      "pin": "v4.34.1@5045d0056413266e57c625dcd7c365b10e377c52;linux-sha256=47bf4bbd78f70c2e9670598ab7124d92b6efb7330ff33e5fbb4030f6fd72e4e4"
    }
  },
  "artifacts": [
    {
      "path": "proofs/lean4/MtsFoundation.lean",
      "sha256": "d5d896bb28651511c25b4c385aa85c97acb0d298f821ae1547053277735052fe"
    }
  ],
  "notes": "External differential proof only. INV-05 proves that a PAIR source remains PairLocal under the existing structural RecursiveInversion graph while its poles are recursively exchanged. The non-collapse proof explicitly reuses the already-derived INV-02 involution and INV-04 one-sided exchange on the same finite Grounded domain, while pole reversal comes from INV-01. No pairPreserved field, new inversion-domain axiom, global arbitrary-Link extensionality, host inverse function, codec/handle identity, or representation order is introduced."
}
