{
  "schema": "mts-proof-evidence/v0.1",
  "theoremId": "INV-05",
  "mts": {
    "acceptedVersion": "v0.14",
    "sourceCommitSha": "fcbc97e2279471c2c5effed57685c5f49ec856be",
    "contractBlobSha": "956fe6e79ddf7a7ba2664113e97633d6fa8a486f"
  },
  "assumptions": [
    "INV-01",
    "INV-02",
    "INV-04"
  ],
  "dependencies": [
    "INV-01",
    "INV-02",
    "INV-04"
  ],
  "result": "proved",
  "authority": "external-cross-check",
  "lane": "coq",
  "proofSource": {
    "repository": "netkeep80/anum_docs",
    "commitSha": "ab0dc7f53ec7ee7fa32942be3684062c5b8bd616",
    "toolchain": {
      "name": "Rocq",
      "pin": "V9.2.0@adfbf1855c348766beb4b790dcc8ebc02f908f63;docker=sha256:61edd1ba7242c19b4261728c75437c1589d9383506ad2747f463a94c82857cf7"
    }
  },
  "artifacts": [
    {
      "path": "proofs/coq/MtsFoundation.v",
      "sha256": "01adf311071e9310899a3f1d0b5eb1004031636061418a2beb5125a3b468d2a4"
    }
  ],
  "notes": "External differential proof only. INV-05 proves that a PAIR source remains PairLocal under the existing structural RecursiveInversion graph while its poles are recursively exchanged. The non-collapse proof explicitly reuses INV-02 involution and INV-04 one-sided exchange on the same finite Grounded domain, while pole reversal comes from INV-01. No pairPreserved field, new inversion-domain axiom, global arbitrary-Link extensionality, host inverse function, codec/handle identity, or representation order is introduced."
}
