{
  "schema": "mts-proof-evidence/v0.1",
  "theoremId": "CTX-03",
  "mts": {
    "acceptedVersion": "v0.14",
    "sourceCommitSha": "fcbc97e2279471c2c5effed57685c5f49ec856be",
    "contractBlobSha": "956fe6e79ddf7a7ba2664113e97633d6fa8a486f"
  },
  "assumptions": [
    "INV-02",
    "INV-07",
    "accepted Link-native Context orientation markers"
  ],
  "dependencies": [
    "INV-02",
    "INV-07"
  ],
  "result": "proved",
  "authority": "external-cross-check",
  "lane": "coq",
  "proofSource": {
    "repository": "netkeep80/anum_docs",
    "commitSha": "c89eeb80e878504896d8fe517b43fb10a80236ff",
    "toolchain": {
      "name": "Rocq",
      "pin": "V9.2.0@adfbf1855c348766beb4b790dcc8ebc02f908f63;docker=sha256:61edd1ba7242c19b4261728c75437c1589d9383506ad2747f463a94c82857cf7"
    }
  },
  "artifacts": [
    {
      "path": "proofs/coq/MtsFoundation.v",
      "sha256": "2c60cdf11827f677469a68f6732e7e3cc80d5aa9dd6b03607c896db9bab28b48"
    }
  ],
  "notes": "External differential proof only. CTX-03 proves an objective pre-selection chiral orbit, Link-native one-sided Context markers, Context-local START_K/END_K roles after marker selection, simultaneous-inversion covariance, and relative Same/Opposite transport composing as Z2. Lean/Rocq host foundations and elementary group theory (Z2) are explicitly external proof projections; none is promoted into MTS ontology, native notation, or semantic authority. No Foundation-global selected orientation, host Bool/Frame/Gauge carrier, ExactSequence/Anum/Q/FORMAL authority, raw-memory-presence authority, or second ontology entity is introduced."
}
