{
  "schema": "mts-proof-evidence/v0.1",
  "theoremId": "FND-02",
  "mts": {
    "acceptedVersion": "v0.14",
    "sourceCommitSha": "fcbc97e2279471c2c5effed57685c5f49ec856be",
    "contractBlobSha": "956fe6e79ddf7a7ba2664113e97633d6fa8a486f"
  },
  "assumptions": [
    "A1RecursiveSeparation"
  ],
  "dependencies": [],
  "result": "proved",
  "authority": "external-cross-check",
  "lane": "coq",
  "proofSource": {
    "repository": "netkeep80/anum_docs",
    "commitSha": "209b46d1bb376b31ad151694886cf0114102d631",
    "toolchain": {
      "name": "Rocq",
      "pin": "V9.2.0@adfbf1855c348766beb4b790dcc8ebc02f908f63;docker=sha256:61edd1ba7242c19b4261728c75437c1589d9383506ad2747f463a94c82857cf7"
    }
  },
  "artifacts": [
    {
      "path": "proofs/coq/MtsFoundation.v",
      "sha256": "ec67d469b43c8bb6fcd6f207f289f132de80c0a0466e38bfe2457db715483949"
    }
  ],
  "notes": "External differential proof only. FND_02_unique_root is derived from explicit A1RecursiveSeparation plus finite Grounded evidence; no A6/pole-extensionality or root-uniqueness axiom is assumed. Accepted MTS source is pinned to the post-acceptance A75 cutover commit; the pre-acceptance ready SHA remains a separate semantic-freeze provenance point. Assumptions metadata aligned with the stabilized P0 boundary in #1820; theorem dependencies and historical exact proof-artifact/source pins are intentionally unchanged."
}
