{
  "schema": "mts-proof-evidence/v0.1",
  "theoremId": "FND-01",
  "mts": {
    "acceptedVersion": "v0.14",
    "sourceCommitSha": "fcbc97e2279471c2c5effed57685c5f49ec856be",
    "contractBlobSha": "956fe6e79ddf7a7ba2664113e97633d6fa8a486f"
  },
  "assumptions": [
    "A1RecursiveSeparation",
    "F2F3OneSidedExistence for grounded realizability of one-sided/root-basis witnesses",
    "LocalSelfDecision for the classified Link"
  ],
  "dependencies": [
    "FND-02"
  ],
  "result": "proved",
  "authority": "external-cross-check",
  "lane": "coq",
  "proofSource": {
    "repository": "netkeep80/anum_docs",
    "commitSha": "006b0397d0a5160c47d34db0f20a377edd224132",
    "toolchain": {
      "name": "Rocq",
      "pin": "V9.2.0@adfbf1855c348766beb4b790dcc8ebc02f908f63;docker=sha256:61edd1ba7242c19b4261728c75437c1589d9383506ad2747f463a94c82857cf7"
    }
  },
  "artifacts": [
    {
      "path": "proofs/coq/MtsFoundation.v",
      "sha256": "01adf311071e9310899a3f1d0b5eb1004031636061418a2beb5125a3b468d2a4"
    }
  ],
  "notes": "External differential proof only. FND-01 proves the four proposition-level self-incidence classes and their finite Grounded realizability without importing normalization or ordered-pole extensionality. Unique ROOT is consumed through FND-02/A1. Ordered-pole identity remains the separate FND-13 theorem. LocalSelfDecision remains explicit, ContextOneSidedNames remains alias-only, and no host enum/codec/handle becomes authority. Assumptions metadata aligned with the stabilized P0 boundary in #1820; theorem dependencies and historical exact proof-artifact/source pins are intentionally unchanged."
}
