{
  "schema": "mts-proof-evidence/v0.1",
  "theoremId": "FND-13",
  "mts": {
    "acceptedVersion": "v0.14",
    "sourceCommitSha": "fcbc97e2279471c2c5effed57685c5f49ec856be",
    "contractBlobSha": "956fe6e79ddf7a7ba2664113e97633d6fa8a486f"
  },
  "assumptions": [
    "F2/F3 name-neutral grounded normal-form completeness on the declared finite R-grounded theorem domain"
  ],
  "dependencies": [],
  "result": "proved",
  "authority": "external-cross-check",
  "lane": "lean4",
  "proofSource": {
    "repository": "netkeep80/anum_docs",
    "commitSha": "b0f1da0f3e4d1a8048cdc378fc2ccb914c736c79",
    "toolchain": {
      "name": "Lean",
      "pin": "v4.34.1@5045d0056413266e57c625dcd7c365b10e377c52;linux-sha256=47bf4bbd78f70c2e9670598ab7124d92b6efb7330ff33e5fbb4030f6fd72e4e4"
    }
  },
  "artifacts": [
    {
      "path": "proofs/lean4/MtsFoundation.lean",
      "sha256": "3af7053dc87893635a3e27d4bf945747fca6778d36c6fc65214ab4ac50065824"
    }
  ],
  "notes": "External differential proof only. FND_13_identity_by_poles is now exactly restricted to the accepted finite Grounded domain and consumes an explicit grounded normal-form completeness premise. Constructor injectivity is proved separately from primitive form projections. FND-02 unique ROOT is no longer presented as a dependency because the FND-13 proof does not consume it. The older arbitrary-Link extensionality strength is preserved only as global_identity_by_poles_from_complete_normalization under a separately named stronger global normalization-completeness premise; ungrounded distinct-node cycles remain outside FND-13."
}
